title,price,area,location,info,date,page
"🔥🔥CHO THUÊ CĂN HỘ 1N1K MỚI FULL NỘI THẤT QUẬN TÂY HỒ, GẦN LOTTE","8,5 triệu/tháng",48 m²,Quận Tây Hồ,"1 PN  Căn hộ dịch vụ, mini",13 giờ trước,https://www.nhatot.com/thue-bat-dong-san-ha-noi?page=13
Cho thuê văn phòng phố Trần Đại Nghĩa. khu PL Giao thông thuận lợi.,4 triệu/tháng,25 m²,Quận Hai Bà Trưng,Văn phòng  Nội thất đầy đủ,Tin nổi bật,https://www.nhatot.com/thue-bat-dong-san-ha-noi?page=13
Vinhomes Gardenia - Mỹ Đình 120m2 3PN full nội thất đẹp giá 24tr/th,24 triệu/tháng,120 m²,Quận Nam Từ Liêm,3 PN  Chung cư,14 giờ trước,https://www.nhatot.com/thue-bat-dong-san-ha-noi?page=13
Siêu phẩm CCMN 1n1k 35m2 full đồ. Ban công thoáng tại Xuân Đỉnh,"5,6 triệu/tháng",35 m²,Quận Bắc Từ Liêm,"1 PN  Căn hộ dịch vụ, mini",14 giờ trước,https://www.nhatot.com/thue-bat-dong-san-ha-noi?page=13
"Vào luôn CH CT9 Sudico Mỹ Đình Sông Đà 60m2 2PN full đồ chỉ 12,5tr/th","12,5 triệu/tháng",60 m²,Quận Nam Từ Liêm,2 PN  Chung cư,14 giờ trước,https://www.nhatot.com/thue-bat-dong-san-ha-noi?page=13
Cho thuê nhà nguyên căn Mỹ Đình DT 45m 5 tầng 4PN full đồ 12 triệu,12 triệu/tháng,45 m²,Quận Nam Từ Liêm,"4 PN  Nhà ngõ, hẻm",14 giờ trước,https://www.nhatot.com/thue-bat-dong-san-ha-noi?page=13
Cho thuê nhà nguyên căn Cầu Giấy DT 55m 4 tầng 4PN full đồ 13 triệu,13 triệu/tháng,55 m²,Quận Cầu Giấy,"4 PN  Nhà ngõ, hẻm",14 giờ trước,https://www.nhatot.com/thue-bat-dong-san-ha-noi?page=13
"Hoàng Thành Pearl - Mỹ Đình 2PN 80m2 đồ cơ bản, nhà đẹp chỉ 14,5tr/th","14,5 triệu/tháng",80 m²,Quận Nam Từ Liêm,2 PN  Chung cư,14 giờ trước,https://www.nhatot.com/thue-bat-dong-san-ha-noi?page=13
"Cho thuê căn hộ studio full nội thất, có ô tô miễn phí Hà Nội giá 6tr",6 triệu/tháng,40 m²,Quận Cầu Giấy,1 PN  Hướng Tây  Chung cư,Tin nổi bật,https://www.nhatot.com/thue-bat-dong-san-ha-noi?page=13
CCMN VĂN TRÌ,"3,8 triệu/tháng",24 m²,Quận Bắc Từ Liêm,Nội thất đầy đủ,Tin nổi bật,https://www.nhatot.com/thue-bat-dong-san-ha-noi?page=13
phòng trọ kép kin KĐT văn Phú TT31Số02,"2,5 triệu/tháng",20 m²,Quận Hà Đông,N/A,14 giờ trước,https://www.nhatot.com/thue-bat-dong-san-ha-noi?page=13
"SIÊU PHẨM 1N1K THANH XUÂN, QUAN NHÂN","7,4 triệu/tháng",35 m²,Quận Thanh Xuân,"1 PN  Căn hộ dịch vụ, mini",14 giờ trước,https://www.nhatot.com/thue-bat-dong-san-ha-noi?page=13
Căn hộ Studio Nguyễn Thượng Hiền - Trần Nhân Tông 5tr- 7tr,5 triệu/tháng,25 m²,Quận Hai Bà Trưng,"1 PN  Căn hộ dịch vụ, mini",14 giờ trước,https://www.nhatot.com/thue-bat-dong-san-ha-noi?page=13
"Chính chủ cần cho thuê Louis Đại Mỗ, L8-35 tầng 1-2. Diện tích 96m2.","9,5 triệu/tháng",96 m²,Quận Nam Từ Liêm,Shophouse  Hoàn thiện cơ bản,14 giờ trước,https://www.nhatot.com/thue-bat-dong-san-ha-noi?page=13
"Mặt bằng kinh doanh 100m2 phố Nguyễn Thị ĐỊnh, Cầu Giấy",21 triệu/tháng,100 m²,Quận Cầu Giấy,Mặt bằng kinh doanh  Nội thất đầy đủ,14 giờ trước,https://www.nhatot.com/thue-bat-dong-san-ha-noi?page=13
ĐH Mở - VTC Tam Trinh 1tr5 2tr2 3tr4 4tr full đẹp khép kín.,"1,5 triệu/tháng",15 m²,Quận Hoàng Mai,N/A,14 giờ trước,https://www.nhatot.com/thue-bat-dong-san-ha-noi?page=13
5 tầng thang máy thông sàn mới trinh nguyên,30 triệu/tháng,100 m²,Quận Nam Từ Liêm,Văn phòng  Hoàn thiện cơ bản,14 giờ trước,https://www.nhatot.com/thue-bat-dong-san-ha-noi?page=13
"CĂN HỘ 1N1K 218 LẠC LONG QUÂN, TÂY HỒ","8,5 triệu/tháng",40 m²,Quận Tây Hồ,"1 PN  Căn hộ dịch vụ, mini",14 giờ trước,https://www.nhatot.com/thue-bat-dong-san-ha-noi?page=13
Cho thuê phòng trọ giá hạt rẻ.,"1,3 triệu/tháng",15 m²,Huyện Hoài Đức,N/A,14 giờ trước,https://www.nhatot.com/thue-bat-dong-san-ha-noi?page=13
Căn hộ Studio Ngõ 80 Nhân Hòa- Quan Nhân 4tr5 - 6tr,"4,5 triệu/tháng",25 m²,Quận Thanh Xuân,"1 PN  Căn hộ dịch vụ, mini",14 giờ trước,https://www.nhatot.com/thue-bat-dong-san-ha-noi?page=13
Căn hộ Studio Ngõ 80 Nhân Hòa- Quan Nhân 4tr5 - 6tr,"4,5 triệu/tháng",25 m²,Quận Thanh Xuân,"1 PN  Căn hộ dịch vụ, mini",14 giờ trước,https://www.nhatot.com/thue-bat-dong-san-ha-noi?page=14
"Căn studio rộng, thoáng mát, đủ đồ tại 322 đường Mỹ Đình","4,4 triệu/tháng",30 m²,Quận Nam Từ Liêm,"1 PN  Căn hộ dịch vụ, mini",14 giờ trước,https://www.nhatot.com/thue-bat-dong-san-ha-noi?page=14
Số 422 Đào Trí -Ph phú Thuận -Q7- TP-HCM -Toà B12-10 -80m2 + 2 ph ngủ,14 triệu/tháng,80 m²,Quận Tây Hồ,2 PN  Chung cư,14 giờ trước,https://www.nhatot.com/thue-bat-dong-san-ha-noi?page=14
"CĂN HỘ 1N1K MINI 285 ĐỘI CẤN, BA ĐÌNH","10,3 triệu/tháng",30 m²,Quận Ba Đình,"1 PN  Căn hộ dịch vụ, mini",15 giờ trước,https://www.nhatot.com/thue-bat-dong-san-ha-noi?page=14
CHÍNH CHỦ - CCMN MỚI - OTO ĐỖ CỬA - BAN CÔNG - 30m2,"4,9 triệu/tháng",30 m²,Quận Cầu Giấy,1 PN  Chung cư,15 giờ trước,https://www.nhatot.com/thue-bat-dong-san-ha-noi?page=14
Căn hộ mini Ngõ 125 Thuỵ Khuê - Hồ Tây 4tr9 -6tr,"4,9 triệu/tháng",25 m²,Quận Tây Hồ,"1 PN  Căn hộ dịch vụ, mini",15 giờ trước,https://www.nhatot.com/thue-bat-dong-san-ha-noi?page=14
Chính chủ cho thuê phòng trọ- ccmini 32m2 nguyên tầng Đường Kim Giang,"3,2 triệu/tháng",32 m²,Quận Hoàng Mai,Nội thất đầy đủ,15 giờ trước,https://www.nhatot.com/thue-bat-dong-san-ha-noi?page=14
PHÒNG Ở GHÉP GIẢ RẺ CHO HSSV UY TÍN ✌🏻✌🏻,"5,8 triệu/tháng",30 m²,Quận Đống Đa,Nội thất đầy đủ,15 giờ trước,https://www.nhatot.com/thue-bat-dong-san-ha-noi?page=14
Cho thuê phòng trọ,2 triệu/tháng,20 m²,Quận Hoàng Mai,Nội thất đầy đủ,15 giờ trước,https://www.nhatot.com/thue-bat-dong-san-ha-noi?page=14
"Cho thuê căn hộ 112m2, 3PN, 2VS, đầy đủ nội thất",16 triệu/tháng,112 m²,Quận Hà Đông,3 PN  Chung cư,15 giờ trước,https://www.nhatot.com/thue-bat-dong-san-ha-noi?page=14
Sốc... Cho thuê 2 ngủ view BT Tây Nam ***,9 triệu/tháng,66 m²,Quận Hoàng Mai,2 PN  Chung cư,Tin nổi bật,https://www.nhatot.com/thue-bat-dong-san-ha-noi?page=14
"Cho thuê nhà Văn Quán gần Đỉnh Nướng 60m2, 4 tầng, 19 triệu/tháng",19 triệu/tháng,60 m²,Quận Hà Đông,"5 PN  Nhà ngõ, hẻm",16 giờ trước,https://www.nhatot.com/thue-bat-dong-san-ha-noi?page=14
"Cho thuê biệt thự Xa La 150m2, 4 tầng 35tr xe container đỗ cửa",35 triệu/tháng,150 m²,Quận Hà Đông,Văn phòng,16 giờ trước,https://www.nhatot.com/thue-bat-dong-san-ha-noi?page=14
"Liền kề Văn Quán 100m 5 tầng phòng rộng, nhà mới sơn sửa đẹp.",27 triệu/tháng,100 m²,Quận Hà Đông,Văn phòng,16 giờ trước,https://www.nhatot.com/thue-bat-dong-san-ha-noi?page=14
Cho thuê toà văn phòng 85m 8 tầng 1 hầm Vạn Phúc chỉ 60tr,60 triệu/tháng,85 m²,Quận Hà Đông,Văn phòng,16 giờ trước,https://www.nhatot.com/thue-bat-dong-san-ha-noi?page=14
"CHO THUÊ NHÀ MỚI 4 TẦNG, 4 NGỦ - LAI XÁ, KIM CHUNG, HOÀI ĐỨC, HN - 7TR",7 triệu/tháng,32 m²,Huyện Hoài Đức,"4 PN  Nhà ngõ, hẻm",16 giờ trước,https://www.nhatot.com/thue-bat-dong-san-ha-noi?page=14
Nhà ông mặt đất cho thuê các tầng trên,"4,5 triệu/tháng",40 m²,Quận Đống Đa,"1 PN  Hướng Tây  Căn hộ dịch vụ, mini",16 giờ trước,https://www.nhatot.com/thue-bat-dong-san-ha-noi?page=14
Cho thuê phòng trọ ngọc thuỵ long biên thoáng mát sạch đẹp,"2,5 triệu/tháng",22 m²,Quận Long Biên,Nội thất đầy đủ,19 giờ trước,https://www.nhatot.com/thue-bat-dong-san-ha-noi?page=14
Cho thuê phòng trọ giá rẻ lý sơn long biên,"1,4 triệu/tháng",10 m²,Quận Long Biên,Nội thất đầy đủ,19 giờ trước,https://www.nhatot.com/thue-bat-dong-san-ha-noi?page=14
"CHO THUÊ CĂN HỘ QUẬN TÂY HỒ, GIÁ RẺ, BAN CÔNG RỘNG Ô TÔ ĐỖ CỬA","6,5 triệu/tháng",45 m²,Quận Tây Hồ,"1 PN  Căn hộ dịch vụ, mini",21 giờ trước,https://www.nhatot.com/thue-bat-dong-san-ha-noi?page=14
"😍😍CĂN HỘ CHO THUÊ NGAY CẦU VƯỢT MAI DỊCH FULL NỘI THẤT, BAN CÔNG😍","6,5 triệu/tháng",35 m²,Quận Cầu Giấy,"1 PN  Căn hộ dịch vụ, mini",21 giờ trước,https://www.nhatot.com/thue-bat-dong-san-ha-noi?page=15
"Cho thuê căn góc 3 ngủ, chung cư 96 Định Công 135 m2","13,5 triệu/tháng",135 m²,Quận Thanh Xuân,3 PN  Chung cư,21 giờ trước,https://www.nhatot.com/thue-bat-dong-san-ha-noi?page=15
Phòng cho nữ thuê gần Nguyễn Chí Thanh siêu cute,3 triệu/tháng,15 m²,Quận Đống Đa,N/A,21 giờ trước,https://www.nhatot.com/thue-bat-dong-san-ha-noi?page=15
Nhà Riêng 358 phố Bùi Xương Trạch,"5,5 triệu/tháng",33 m²,Quận Thanh Xuân,Nhà trống,21 giờ trước,https://www.nhatot.com/thue-bat-dong-san-ha-noi?page=15
Cho thuê phòng trọ gần ngã tư Văn Tiến Dũng 3-3.4tr,"3,2 triệu/tháng",20 m²,Quận Bắc Từ Liêm,Nội thất đầy đủ,22 giờ trước,https://www.nhatot.com/thue-bat-dong-san-ha-noi?page=15
CĂN HỘ STUDIO BAN CÔNG CỬA SỔ FULL NỘI THẤT NGAY LÊ ĐỨC THỌ,5 triệu/tháng,35 m²,Quận Nam Từ Liêm,"1 PN  Căn hộ dịch vụ, mini",22 giờ trước,https://www.nhatot.com/thue-bat-dong-san-ha-noi?page=15
CHO THUÊ NHÀ NGUYÊN CĂN SIÊU RỘNG 5 TẦNG NGAY BẾN XE MỸ ĐÌNH,11 triệu/tháng,150 m²,Quận Nam Từ Liêm,"3 PN  Căn hộ dịch vụ, mini",22 giờ trước,https://www.nhatot.com/thue-bat-dong-san-ha-noi?page=15
cho thuê chung cư geleximco đuôi cá 897 giải phóng,11 triệu/tháng,65 m²,Quận Hoàng Mai,2 PN  Hướng Nam  Chung cư,Tin nổi bật,https://www.nhatot.com/thue-bat-dong-san-ha-noi?page=15
CHO THUÊ TẦNG 2 – MẶT ĐƯỜNG RỘNG – VỊ TRÍ ĐẸP,5 triệu/tháng,75 m²,Huyện Thanh Trì,"2 PN  Nhà mặt phố, mặt tiền",22 giờ trước,https://www.nhatot.com/thue-bat-dong-san-ha-noi?page=15
"CHO THUÊ ĐẤT NHÀ MẶT ĐƯỜNG CHÍNH CHỦ MẶT TIỀN 11,7m, 252m2","17,5 triệu/tháng",252 m²,Huyện Đông Anh,Đất thổ cư  Ngang 11.7 m,23 giờ trước,https://www.nhatot.com/thue-bat-dong-san-ha-noi?page=15
Phòng trọ giá rẻ,800000 đ/tháng,11 m²,Quận Thanh Xuân,N/A,23 giờ trước,https://www.nhatot.com/thue-bat-dong-san-ha-noi?page=15
cần cho thuê cân hô  ngõ 374/3 trần khát trân 25 m2  xây mới thang máy,"4,6 triệu/tháng",25 m²,Quận Hai Bà Trưng,Nội thất đầy đủ,Tin nổi bật,https://www.nhatot.com/thue-bat-dong-san-ha-noi?page=15
"CHÍNH CHỦ CHO THUÊ 2N1VS CHỈ 7,2Tr TẠI VINHOMES OCP","7,2 triệu/tháng",59 m²,Huyện Gia Lâm,2 PN  Chung cư,23 giờ trước,https://www.nhatot.com/thue-bat-dong-san-ha-noi?page=15
"SIÊU HÓT CĂN 1PN+ CHỈ 5,5 Tr Full ĐỒ LIỀN TƯỜNG TẠI VHOP","5,5 triệu/tháng",47 m²,Huyện Gia Lâm,1 PN  Chung cư,23 giờ trước,https://www.nhatot.com/thue-bat-dong-san-ha-noi?page=15
Cho thuê căn hộ 1N1K full nội thất 50m2 mặt phố lạc long quân,9 triệu/tháng,50 m²,Quận Tây Hồ,"1 PN  Căn hộ dịch vụ, mini",Tin nổi bật,https://www.nhatot.com/thue-bat-dong-san-ha-noi?page=15
"CHÍNH CHỦ CHO THUÊ NHÀ THUỴ KHUÊ, TÂY HỒ MỚI XÂY THOÁNG MÁT - CÁCH PHỐ",16 triệu/tháng,33 m²,Quận Tây Hồ,"3 PN  Hướng Nam  Nhà ngõ, hẻm",Tin nổi bật,https://www.nhatot.com/thue-bat-dong-san-ha-noi?page=15
Chính chủ cho thuê chung cư Skylight Minh Khai,15 triệu/tháng,100 m²,Quận Hai Bà Trưng,3 PN  Hướng Bắc  Chung cư,24 giờ trước,https://www.nhatot.com/thue-bat-dong-san-ha-noi?page=15
cho thuê nguyên t4 nội thất đầy đủ,550000 đ/tháng,90 m²,Quận Hà Đông,Nội thất đầy đủ,Tin nổi bật,https://www.nhatot.com/thue-bat-dong-san-ha-noi?page=15
"Cho thuê mặt bằng trong ngõ dạy học, coworking",3 triệu/tháng,50 m²,Quận Ba Đình,Văn phòng  Nội thất đầy đủ,24 giờ trước,https://www.nhatot.com/thue-bat-dong-san-ha-noi?page=15
6 TẦNG - Ô TÔ - LÔ GÓC - 4 NGỦ - Ở NGAY - SÁT PHỐ,16 triệu/tháng,35 m²,Quận Hoàng Mai,"4 PN  Nhà ngõ, hẻm",24 giờ trước,https://www.nhatot.com/thue-bat-dong-san-ha-noi?page=15
Quỹ căn hộ cho thuê tháng 8 chính chủ tại Vinhomes Ocean Park giá tốt,"5,6 triệu/tháng",50 m²,Huyện Gia Lâm,1 PN  Hướng Tây Bắc  Chung cư,hôm qua,https://www.nhatot.com/thue-bat-dong-san-ha-noi?page=16
"phòng mới 30m2 cho hộ gia đình, người đi làm, sinh viên","3,5 triệu/tháng",30 m²,Quận Nam Từ Liêm,N/A,Tin nổi bật,https://www.nhatot.com/thue-bat-dong-san-ha-noi?page=16
💎 CĂN HỘ 1 PHÒNG NGỦ NGAY HỒ TÂY – ĐẲNG CẤP TỪ KHÔNG GIAN SỐNG 💎,11 triệu/tháng,45 m²,Quận Tây Hồ,"1 PN  Căn hộ dịch vụ, mini",hôm qua,https://www.nhatot.com/thue-bat-dong-san-ha-noi?page=16
CHO THUÊ CĂN HỘ PHÒNG 2 NGỦ 1 KHÁCH ĐẦY ĐỦ NỘI THẤT MỚI NGAY HỒ TÂY,8 triệu/tháng,60 m²,Quận Tây Hồ,"2 PN  Căn hộ dịch vụ, mini",hôm qua,https://www.nhatot.com/thue-bat-dong-san-ha-noi?page=16
thuê nhà nguyễn xiển nguyên căn,12 triệu/tháng,38 m²,Quận Thanh Xuân,"4 PN  Hướng Đông Nam  Nhà ngõ, hẻm",hôm qua,https://www.nhatot.com/thue-bat-dong-san-ha-noi?page=16
"🌟KHAI TRƯƠNG CĂN HỘ STUDIO, 1PN TRUNG TÂM CẦU GIẤY🌟","7,8 triệu/tháng",35 m²,Quận Cầu Giấy,"1 PN  Căn hộ dịch vụ, mini",hôm qua,https://www.nhatot.com/thue-bat-dong-san-ha-noi?page=16
[100-200m2] CHO THUÊ CĂN HỘ ĐỂ Ở LÀM VĂN PHÒNG TÂY HỒ BA ĐÌNH RỘNG,"22,5 triệu/tháng",100 m²,Quận Ba Đình,"2 PN  Căn hộ dịch vụ, mini",hôm qua,https://www.nhatot.com/thue-bat-dong-san-ha-noi?page=16
CHO THUÊ CĂN HỘ 1 NGỦ 1 KHÁCH NGAY HỒ TÂY,7 triệu/tháng,40 m²,Quận Cầu Giấy,"1 PN  Căn hộ dịch vụ, mini",hôm qua,https://www.nhatot.com/thue-bat-dong-san-ha-noi?page=16
"căn hộ fun nội thất, 40m2, ban công cực thoáng, 3.5tr","3,5 triệu/tháng",40 m²,Quận Hoàng Mai,Nội thất đầy đủ,hôm qua,https://www.nhatot.com/thue-bat-dong-san-ha-noi?page=16
KHAI TRƯƠNG CĂN HỘ PHÒNG 2 NGỦ 1 KHÁCH NGAY CÔNG VIÊN CẦU GIẤY,"8,5 triệu/tháng",45 m²,Quận Cầu Giấy,"2 PN  Căn hộ dịch vụ, mini",hôm qua,https://www.nhatot.com/thue-bat-dong-san-ha-noi?page=16
cho thuê nhà gần hồ Gươm,7 triệu/tháng,30 m²,Quận Hoàn Kiếm,N/A,hôm qua,https://www.nhatot.com/thue-bat-dong-san-ha-noi?page=16
🌒 CĂN HỘ 1PN1PK - STUDIO MỸ ĐÌNH - CẦU GIẤY FULL NT BANCOL RỘNG - MỚI,"6,2 triệu/tháng",40 m²,Quận Nam Từ Liêm,"1 PN  Căn hộ dịch vụ, mini",hôm qua,https://www.nhatot.com/thue-bat-dong-san-ha-noi?page=16
Khai trương toà nhà mới tinh tại Miếu Đầm,"4,9 triệu/tháng",25 m²,Quận Nam Từ Liêm,Nội thất đầy đủ,hôm qua,https://www.nhatot.com/thue-bat-dong-san-ha-noi?page=16
CHO THUÊ CĂN HỘ 2PN + 1 + 2WC 64m² - DỌN VÀO Ở LUÔN!!!,11 triệu/tháng,64 m²,Quận Nam Từ Liêm,2 PN  Chung cư,hôm qua,https://www.nhatot.com/thue-bat-dong-san-ha-noi?page=16
"Cho thuê CCMN 1n1k 35m2 Full nội thất, ban công thoáng - Lạc Long Quân","6,5 triệu/tháng",35 m²,Quận Tây Hồ,"1 PN  Căn hộ dịch vụ, mini",hôm qua,https://www.nhatot.com/thue-bat-dong-san-ha-noi?page=16
CHO THUÊ CCMN PHỐ MỄ TRÌ THƯỢNG. BAN CÔNG. THANG MÁY. GIÁ 5TR5,"5,5 triệu/tháng",25 m²,Quận Nam Từ Liêm,"1 PN  Căn hộ dịch vụ, mini",hôm qua,https://www.nhatot.com/thue-bat-dong-san-ha-noi?page=16
"Phòng trọ khép kín mới siêu rộng cách đh Thương Mại 2,5km","4,5 triệu/tháng",35 m²,Quận Nam Từ Liêm,Nội thất đầy đủ,Tin nổi bật,https://www.nhatot.com/thue-bat-dong-san-ha-noi?page=16
Nhà nguyên phố Bắc Cầu cho thuê,8 triệu/tháng,50 m²,Quận Long Biên,"2 PN  Nhà ngõ, hẻm",hôm qua,https://www.nhatot.com/thue-bat-dong-san-ha-noi?page=16
"Siêu Hot CCMN 30m2 Full nội thất. Thang máy, Rộng thoáng tại Hào Nam","5,3 triệu/tháng",30 m²,Quận Đống Đa,"1 PN  Căn hộ dịch vụ, mini",hôm qua,https://www.nhatot.com/thue-bat-dong-san-ha-noi?page=16
Cho thuê phòng Xuân Diệu - 25m2 - full - 3tr5,"3,5 triệu/tháng",25 m²,Quận Tây Hồ,N/A,hôm qua,https://www.nhatot.com/thue-bat-dong-san-ha-noi?page=16
Cho thuê phòng Xuân Diệu - 25m2 - full - 3tr5,"3,5 triệu/tháng",25 m²,Quận Tây Hồ,N/A,hôm qua,https://www.nhatot.com/thue-bat-dong-san-ha-noi?page=17
"Cho thuê nhà phố kinh doanh phố Việt Hưng 90 m , vỉa hè rộng 3 thoáng",35 triệu/tháng,90 m²,Quận Long Biên,Mặt bằng kinh doanh  Nội thất đầy đủ,hôm qua,https://www.nhatot.com/thue-bat-dong-san-ha-noi?page=17
CHO THUÊ STUDIO MỚI SIÊU RỘNG Ở ĐƯỢC 3- 4 NG NGAY SÂN VẬN ĐỘNG MỸ ĐÌNH,"4,5 triệu/tháng",35 m²,Quận Nam Từ Liêm,"1 PN  Căn hộ dịch vụ, mini",Tin nổi bật,https://www.nhatot.com/thue-bat-dong-san-ha-noi?page=17
Cho thue phòng trọ ở ghép - Phố Đào Tấn - 1tr1,"1,1 triệu/tháng",70 m²,Quận Ba Đình,Nội thất cao cấp,hôm qua,https://www.nhatot.com/thue-bat-dong-san-ha-noi?page=17
Nhà TRỌ ở ghép - Đốc Ngữ -1.3triệu/ 1 tháng/fulll bao dịch vụ trọn gói,"1,3 triệu/tháng",108 m²,Quận Ba Đình,Nội thất cao cấp,hôm qua,https://www.nhatot.com/thue-bat-dong-san-ha-noi?page=17
Cho thuê mặt bằng kinh doanh Ngô Quyền Hà Đông,"7,5 triệu/tháng",20 m²,Quận Hà Đông,Mặt bằng kinh doanh  Hoàn thiện cơ bản,hôm qua,https://www.nhatot.com/thue-bat-dong-san-ha-noi?page=17
Chính chủ cho thuê căn hộ Làng Quốc Tế Thăng Long 105m2,14 triệu/tháng,105 m²,Quận Cầu Giấy,2 PN  Chung cư,hôm qua,https://www.nhatot.com/thue-bat-dong-san-ha-noi?page=17
"Cho thuê biệt thự Cổ Linh, 230m2 - 4 tầng, 25tr/t",25 triệu/tháng,230 m²,Quận Long Biên,5 PN  Nhà biệt thự,hôm qua,https://www.nhatot.com/thue-bat-dong-san-ha-noi?page=17
"Cho thuê nhà mặt phố Chùa Bộc, 110m2 x 3 tầng, 100tr/t",100 triệu/tháng,330 m²,Quận Đống Đa,Mặt bằng kinh doanh,hôm qua,https://www.nhatot.com/thue-bat-dong-san-ha-noi?page=17
"Ngõ 6 Đội Nhân chợ Vĩnh Phúc gần Đội Cấn, viện quân Y","2,2 triệu/tháng",20 m²,Quận Ba Đình,N/A,hôm qua,https://www.nhatot.com/thue-bat-dong-san-ha-noi?page=17
PHÒNG TRỌ KHÉP KÍN TẠI VĨNH QUỲNH CHÍNH CHỦ CHO THUÊ,"1,3 triệu/tháng",17 m²,Huyện Thanh Trì,N/A,hôm qua,https://www.nhatot.com/thue-bat-dong-san-ha-noi?page=17
"Phòng Trọ: Gần hồ Đền Lừ, Hoàng Mai, HN","1,7 triệu/tháng",20 m²,Quận Hoàng Mai,Nội thất đầy đủ,hôm qua,https://www.nhatot.com/thue-bat-dong-san-ha-noi?page=17
". ĐC : Ngõ Giếng Mứt - phố Bạch Mai gần trung tâm thương mại Chợ Mơ ,","2,5 triệu/tháng",20 m²,Quận Hai Bà Trưng,Nội thất đầy đủ,hôm qua,https://www.nhatot.com/thue-bat-dong-san-ha-noi?page=17
phong.tro.quan.hoan.kiem,"1,1 triệu/tháng",10 m²,Quận Hoàn Kiếm,Nhà trống,hôm qua,https://www.nhatot.com/thue-bat-dong-san-ha-noi?page=17
Cần cho thuê căn hộ chung cư Lilama 124 Minh Khai,13 triệu/tháng,76 m²,Quận Hai Bà Trưng,2 PN  Chung cư,Tin nổi bật,https://www.nhatot.com/thue-bat-dong-san-ha-noi?page=17
"PHÒNG  Ở NGÕ 190 NGUYỄN TRÃI,GẦN ROYAL CITY& NGÃ TƯ SỞ-Ở NGAY","1,8 triệu/tháng",30 m²,Quận Thanh Xuân,N/A,hôm qua,https://www.nhatot.com/thue-bat-dong-san-ha-noi?page=17
Cho thuê phòng ở ngõ 105 Láng Hạ - Yên Lãng vào ở ngay,"2,3 triệu/tháng",30 m²,Quận Đống Đa,N/A,hôm qua,https://www.nhatot.com/thue-bat-dong-san-ha-noi?page=17
BÓC SEAL CĂN HỘ 2N1K TẠI YÊN HÒA,9 triệu/tháng,35 m²,Quận Cầu Giấy,"2 PN  Căn hộ dịch vụ, mini",hôm qua,https://www.nhatot.com/thue-bat-dong-san-ha-noi?page=17
"Phòng trọ chính chủ, giá rẻ, khép kín, riêng tư, an ninh, có điều hòa","1,6 triệu/tháng",25 m²,Quận Thanh Xuân,N/A,hôm qua,https://www.nhatot.com/thue-bat-dong-san-ha-noi?page=17
CHO THUÊ PHÒNG TẠI TRƯỜNG CHINH - NGÃ TƯ SỞ VÀ TÔN THẤT TÙNG,2 triệu/tháng,30 m²,Quận Đống Đa,N/A,hôm qua,https://www.nhatot.com/thue-bat-dong-san-ha-noi?page=17
"🏠 Cho thuê phòng trọ khép kín – Minh Khai, đối diện Times City",3 triệu/tháng,28 m²,Quận Hai Bà Trưng,Nhà trống,hôm qua,https://www.nhatot.com/thue-bat-dong-san-ha-noi?page=18
cho thuê phòng Studio đầy đủ nội thất ngõ 191 Lê Quang Đạo,"4,3 triệu/tháng",25 m²,Quận Nam Từ Liêm,Nội thất đầy đủ,hôm qua,https://www.nhatot.com/thue-bat-dong-san-ha-noi?page=18
Căn hộ Studio 2n1k Ngõ 295 Bạch Mai 10tr5,"10,5 triệu/tháng",60 m²,Quận Hai Bà Trưng,"2 PN  Căn hộ dịch vụ, mini",hôm qua,https://www.nhatot.com/thue-bat-dong-san-ha-noi?page=18
"cho thuê văn phòng, kho thông sàn",7 triệu/tháng,82 m²,Quận Hoàng Mai,Văn phòng  Bàn giao thô,hôm qua,https://www.nhatot.com/thue-bat-dong-san-ha-noi?page=18
Cho thuê nhà 4 tầng mặt ngõ đường Lĩnh Nam,6 triệu/tháng,25 m²,Quận Hoàng Mai,"2 PN  Hướng Tây Nam  Nhà ngõ, hẻm",hôm qua,https://www.nhatot.com/thue-bat-dong-san-ha-noi?page=18
Cho thuê căn hộ chung cư Keangnam Hanoi Landmark Tower 4 phòng ngủ,60 triệu/tháng,156 m²,Quận Nam Từ Liêm,4 PN  Chung cư,hôm qua,https://www.nhatot.com/thue-bat-dong-san-ha-noi?page=18
"Phòng trọ gác xép vskk chính chủ đường Trương Định cách khu BKX 2,5km",3 triệu/tháng,23 m²,Quận Hoàng Mai,Nhà trống,hôm qua,https://www.nhatot.com/thue-bat-dong-san-ha-noi?page=18
CHO THUÊ CĂN HỘ TẠI ĐỐNG ĐA - 110m2/4PN,10 triệu/tháng,110 m²,Quận Đống Đa,"4 PN  Tập thể, cư xá",hôm qua,https://www.nhatot.com/thue-bat-dong-san-ha-noi?page=18
"Cho thuê căn hộ chung cư ĐÔ thị Định Công, DT 100m2, 3PN, 2WC, đủ đồ",12 triệu/tháng,100 m²,Quận Hoàng Mai,3 PN  Chung cư,hôm qua,https://www.nhatot.com/thue-bat-dong-san-ha-noi?page=18
"Phòng trọ 12m2 ngõ Xã Đàn 2, Đống Đa","2,2 triệu/tháng",12 m²,Quận Đống Đa,Nội thất đầy đủ,hôm qua,https://www.nhatot.com/thue-bat-dong-san-ha-noi?page=18
"CHO THUÊ NHÀ RIÊNG NGÕ 569 LẠC LONG QUÂN - 50m2x3 tầng, 3PN",12 triệu/tháng,50 m²,Quận Tây Hồ,"3 PN  Nhà ngõ, hẻm",hôm qua,https://www.nhatot.com/thue-bat-dong-san-ha-noi?page=18
Mặt tiền tầng 1 cho thuê kinh doanh,"6,5 triệu/tháng",50 m²,Quận Hà Đông,Shophouse  Hoàn thiện cơ bản,hôm qua,https://www.nhatot.com/thue-bat-dong-san-ha-noi?page=18
"cho nhóm sv thuê hoặc hộ gia đình , nhà riêng k chung chủ",7 triệu/tháng,30 m²,Quận Hai Bà Trưng,2 PN  Nhà phố liền kề,hôm qua,https://www.nhatot.com/thue-bat-dong-san-ha-noi?page=18
LÊN LỊCH XEM CĂN DUPLEX FULL ĐỒ BAN CÔNG GẦN HỌC VIỆN BƯU CHÍNH,"5,8 triệu/tháng",30 m²,Quận Cầu Giấy,1 PN  Duplex,Tin nổi bật,https://www.nhatot.com/thue-bat-dong-san-ha-noi?page=18
"Đập hộp CCMN 30M2 full đồ, ban công thoáng mát, tại Trường Chinh","5,8 triệu/tháng",30 m²,Quận Đống Đa,"1 PN  Căn hộ dịch vụ, mini",hôm qua,https://www.nhatot.com/thue-bat-dong-san-ha-noi?page=18
"PHÒNG FULL NỘI THẤT– KHÔNG CHUNG CHỦ – ĐIỆN NƯỚC GIÁ RẺ, WIFI MIỄN PHÍ",4 triệu/tháng,31 m²,Quận Long Biên,Nội thất đầy đủ,hôm qua,https://www.nhatot.com/thue-bat-dong-san-ha-noi?page=18
TT72 - CCMN FULL ĐỒ KHU VỰC CẦU DIỄN - BẮC TỪ LIÊM,"3,85 triệu/tháng",25 m²,Quận Cầu Giấy,N/A,hôm qua,https://www.nhatot.com/thue-bat-dong-san-ha-noi?page=18
"Cho thuê văn phòng, mặt bằng kinh doanh, tầng 2 phố Lê Thánh Tông",22 triệu/tháng,156 m²,Quận Hoàn Kiếm,Văn phòng,Tin nổi bật,https://www.nhatot.com/thue-bat-dong-san-ha-noi?page=18
"Cho thuê căn hộ giá rẻ 2,5 triệu/ phòng tại Ngọc Hồi, Hoàng Liệt,gần","2,5 triệu/tháng",57 m²,Quận Hoàng Mai,Nội thất đầy đủ,hôm qua,https://www.nhatot.com/thue-bat-dong-san-ha-noi?page=18
KHAI TRƯƠNG CĂN HỘ GÁC XÉP FULL ĐỒ BAN CÔNG GẦN HỌC VIỆN BƯU CHÍNH,"5,8 triệu/tháng",30 m²,Quận Tây Hồ,"1 PN  Căn hộ dịch vụ, mini",Tin nổi bật,https://www.nhatot.com/thue-bat-dong-san-ha-noi?page=18
"CCMN 30m2 Full nội thất, ban công, máy giặt tại Trương Định",5 triệu/tháng,30 m²,Quận Hoàng Mai,"1 PN  Căn hộ dịch vụ, mini",hôm qua,https://www.nhatot.com/thue-bat-dong-san-ha-noi?page=19
"🏢CHUNG CƯ MINI NAM TỪ LIÊM – Phòng đẹp, Full nội thất, Giá dịch vụ rẻ","4,5 triệu/tháng",25 m²,Quận Nam Từ Liêm,Nội thất đầy đủ,hôm qua,https://www.nhatot.com/thue-bat-dong-san-ha-noi?page=19
